"","sort.v2024","species_code","Clements.v2024b.change","text.for.website.v2024b","category","English.name","scientific.name","range","order","family","extinct","extinct.year","sort_v2023","canada_ak_conus"
"1",28,"rheida1","sequence","Modify linear sequence such that the Rheiformes/Tinamiformes clade follows Apterygidae","family","Rheas","Rheidae",NA,"Rheiformes","Rheidae (Rheas)",NA,NA,9,FALSE
"2",35,"lesrhe2",NA,NA,"species","Lesser Rhea","Rhea pennata",NA,"Rheiformes","Rheidae (Rheas)",NA,NA,16,FALSE
"3",155,"rewtin1",NA,NA,"species","Red-winged Tinamou","Rhynchotus rufescens",NA,"Tinamiformes","Tinamidae (Tinamous)",NA,NA,136,FALSE
"4",231,"wfwduc1",NA,NA,"species","White-faced Whistling-Duck","Dendrocygna viduata","Africa, Madagascar, and Comoros; disjunctly Costa Rica to Brazil","Anseriformes","Anatidae (Ducks, Geese, and Waterfowl)",NA,NA,231,FALSE
"5",233,"bbwduc",NA,NA,"species","Black-bellied Whistling-Duck","Dendrocygna autumnalis",NA,"Anseriformes","Anatidae (Ducks, Geese, and Waterfowl)",NA,NA,233,TRUE
"6",237,"wiwduc1",NA,NA,"species","West Indian Whistling-Duck","Dendrocygna arborea","Bahamas, Greater Antilles, and northern Lesser Antilles","Anseriformes","Anatidae (Ducks, Geese, and Waterfowl)",NA,NA,236,FALSE
"7",239,"fuwduc",NA,NA,"species","Fulvous Whistling-Duck","Dendrocygna bicolor","eastern Africa, Madagascar, and southern Asia; disjunctly southern USA to Argentina","Anseriformes","Anatidae (Ducks, Geese, and Waterfowl)",NA,NA,238,TRUE
"8",248,"lewduc1",NA,NA,"species","Lesser Whistling-Duck","Dendrocygna javanica","Indian subcontinent to southeastern Asia and Greater Sundas","Anseriformes","Anatidae (Ducks, Geese, and Waterfowl)",NA,NA,247,FALSE
"9",251,"whistl1",NA,NA,"spuh","whistling-duck sp.","Dendrocygna sp.",NA,"Anseriformes","Anatidae (Ducks, Geese, and Waterfowl)",NA,NA,250,FALSE
"10",255,"bahgoo",NA,NA,"species","Bar-headed Goose","Anser indicus","alpine lakes in central Asia; winters to India and Myanmar","Anseriformes","Anatidae (Ducks, Geese, and Waterfowl)",NA,NA,254,FALSE
"11",256,"empgoo",NA,NA,"species","Emperor Goose","Anser canagicus","breeds in northeastern Siberia and western Alaska; primarily winters in Alaska, from the Aleutian Islands to the Alaska Peninsula","Anseriformes","Anatidae (Ducks, Geese, and Waterfowl)",NA,NA,255,TRUE
"12",257,"snogoo",NA,NA,"species","Snow Goose","Anser caerulescens",NA,"Anseriformes","Anatidae (Ducks, Geese, and Waterfowl)",NA,NA,256,TRUE
"13",258,"snogoo1",NA,NA,"subspecies",NA,"Anser caerulescens caerulescens","breeds from northeastern Siberia and Alaska to northwestern and north-central Canada; winters in the southern USA from California to New York and to northern Mexico","Anseriformes","Anatidae (Ducks, Geese, and Waterfowl)",NA,NA,257,FALSE
"14",259,"snogoo2",NA,NA,"subspecies",NA,"Anser caerulescens atlanticus","northwestern Greenland and islands in Baffin Bay; winters to northeastern Mexico","Anseriformes","Anatidae (Ducks, Geese, and Waterfowl)",NA,NA,258,FALSE
"15",261,"rosgoo",NA,NA,"species","Ross's Goose","Anser rossii","breeds tundra of arctic north-central Canada; winters to western and central USA and central Mexico","Anseriformes","Anatidae (Ducks, Geese, and Waterfowl)",NA,NA,260,TRUE
"16",264,"gragoo",NA,NA,"species","Graylag Goose","Anser anser",NA,"Anseriformes","Anatidae (Ducks, Geese, and Waterfowl)",NA,NA,263,FALSE
"17",276,"gwfgoo",NA,NA,"species","Greater White-fronted Goose","Anser albifrons",NA,"Anseriformes","Anatidae (Ducks, Geese, and Waterfowl)",NA,NA,271,TRUE
"18",288,"lwfgoo",NA,NA,"species","Lesser White-fronted Goose","Anser erythropus","breeds arctic Eurasia; winters to southern Europe, India, and China","Anseriformes","Anatidae (Ducks, Geese, and Waterfowl)",NA,NA,282,FALSE
"19",289,"y00707",NA,NA,"slash","Greater/Lesser White-fronted Goose","Anser albifrons/erythropus",NA,"Anseriformes","Anatidae (Ducks, Geese, and Waterfowl)",NA,NA,283,FALSE
"20",290,"taibeg1",NA,NA,"species","Taiga Bean-Goose","Anser fabalis",NA,"Anseriformes","Anatidae (Ducks, Geese, and Waterfowl)",NA,NA,284,FALSE
"21",294,"tunbeg1",NA,NA,"species","Tundra Bean-Goose","Anser serrirostris",NA,"Anseriformes","Anatidae (Ducks, Geese, and Waterfowl)",NA,NA,288,FALSE
"22",299,"pifgoo",NA,NA,"species","Pink-footed Goose","Anser brachyrhynchus","breeds Greenland, Iceland, and Spitsbergen; winters northwestern Europe","Anseriformes","Anatidae (Ducks, Geese, and Waterfowl)",NA,NA,293,FALSE
"23",301,"anser1",NA,NA,"spuh","Anser sp.","Anser sp.",NA,"Anseriformes","Anatidae (Ducks, Geese, and Waterfowl)",NA,NA,295,FALSE
"24",302,"brant",NA,NA,"species","Brant","Branta bernicla",NA,"Anseriformes","Anatidae (Ducks, Geese, and Waterfowl)",NA,NA,296,TRUE
"25",305,"blkbra1",NA,NA,"group (monotypic)","Brant (Black)","Branta bernicla nigricans","breeds northeastern Siberia, western and northern Alaska, and northwestern Canada; winters from from Japan to Korea and northeastern China, and from Alaska to northwestern Mexico","Anseriformes","Anatidae (Ducks, Geese, and Waterfowl)",NA,NA,299,TRUE
"26",310,"bargoo",NA,NA,"species","Barnacle Goose","Branta leucopsis","high Arctic eastern Greenland, Svalbard (north of Norway), Novaya Zemlya and nearby Kolguyev and Vaygach islands (northwestern Russia); winters to coastal northern British Isles, southern Scandinavia, and northwestern Europe","Anseriformes","Anatidae (Ducks, Geese, and Waterfowl)",NA,NA,304,FALSE
"27",319,"cacgoo1",NA,NA,"species","Cackling Goose","Branta hutchinsii",NA,"Anseriformes","Anatidae (Ducks, Geese, and Waterfowl)",NA,NA,313,TRUE
"28",320,"alcgoo1",NA,NA,"group (monotypic)","Cackling Goose (Aleutian)","Branta hutchinsii leucopareia","locally in Aleutian and Semidi islands, Alaska (formerly bred from Kuril and Commander islands eastward to near Kodiak Island); winters Oregon and California","Anseriformes","Anatidae (Ducks, Geese, and Waterfowl)",NA,NA,314,FALSE
"29",322,"cacgoo2",NA,NA,"group (monotypic)","Cackling Goose (minima)","Branta hutchinsii minima","breeds coastal western Alaska; winters primarily in California","Anseriformes","Anatidae (Ducks, Geese, and Waterfowl)",NA,NA,316,FALSE
"30",330,"cangoo",NA,NA,"species","Canada Goose","Branta canadensis",NA,"Anseriformes","Anatidae (Ducks, Geese, and Waterfowl)",NA,NA,324,TRUE
"31",338,"cangoo9",NA,NA,"subspecies",NA,"Branta canadensis parvipes","central Alaska to Canadian prairie provinces; winters southern USA","Anseriformes","Anatidae (Ducks, Geese, and Waterfowl)",NA,NA,332,FALSE
"32",351,"y00470",NA,NA,"slash","Cackling/Canada Goose","Branta hutchinsii/canadensis",NA,"Anseriformes","Anatidae (Ducks, Geese, and Waterfowl)",NA,NA,345,FALSE
"33",353,"hawgoo",NA,NA,"species","Hawaiian Goose","Branta sandvicensis","upland lava flows of Hawaii; introduced to Maui","Anseriformes","Anatidae (Ducks, Geese, and Waterfowl)",NA,NA,347,FALSE
"34",355,"rebgoo1",NA,NA,"species","Red-breasted Goose","Branta ruficollis","breeds low Arctic tundra of Yamal, Gydan, and Taymyr peninsulas (northwestern Siberia); winters to western and southern Black Sea and southern Caspian Sea; prone to vagrancy elsewhere in Eurasia","Anseriformes","Anatidae (Ducks, Geese, and Waterfowl)",NA,NA,348,FALSE
"35",359,"branta1",NA,NA,"spuh","Branta sp.","Branta sp.",NA,"Anseriformes","Anatidae (Ducks, Geese, and Waterfowl)",NA,NA,352,FALSE
"36",365,"mutswa",NA,NA,"species","Mute Swan","Cygnus olor","west-central to east-central Palearctic region from central Europe to southeastern China; introduced widely including to western and southwestern Europe, Japan, and eastern North America","Anseriformes","Anatidae (Ducks, Geese, and Waterfowl)",NA,NA,358,TRUE
"37",367,"blkswa",NA,NA,"species","Black Swan","Cygnus atratus","Australia including Tasmania; New Zealand, where formerly occurred but was eradicated, later was reintroduced and also self-colonized","Anseriformes","Anatidae (Ducks, Geese, and Waterfowl)",NA,NA,360,FALSE
"38",370,"truswa",NA,NA,"species","Trumpeter Swan","Cygnus buccinator","North America from western and central Alaska eastward through east-central Canada and southward through western and central USA; some southward movement in winter; early extirpations and subsequent reintroductions cloud distributional knowledge","Anseriformes","Anatidae (Ducks, Geese, and Waterfowl)",NA,NA,363,TRUE
"39",372,"tunswa",NA,NA,"species","Tundra Swan","Cygnus columbianus",NA,"Anseriformes","Anatidae (Ducks, Geese, and Waterfowl)",NA,NA,365,TRUE
"40",378,"whoswa",NA,NA,"species","Whooper Swan","Cygnus cygnus","Palearctic; winters to central Asia and southeastern China","Anseriformes","Anatidae (Ducks, Geese, and Waterfowl)",NA,NA,371,FALSE
"41",382,"swan1",NA,NA,"spuh","swan sp.","Cygnus sp.",NA,"Anseriformes","Anatidae (Ducks, Geese, and Waterfowl)",NA,NA,375,FALSE
"42",389,"uplgoo1",NA,NA,"species","Upland Goose","Chloephaga picta",NA,"Anseriformes","Anatidae (Ducks, Geese, and Waterfowl)",NA,NA,382,FALSE
"43",401,"goose1",NA,NA,"spuh","goose sp.","Anatidae (goose sp.)",NA,"Anseriformes","Anatidae (Ducks, Geese, and Waterfowl)",NA,NA,393,FALSE
"44",405,"egygoo",NA,NA,"species","Egyptian Goose","Alopochen aegyptiaca","Nile Valley of Egypt and Sudan, and sub-Saharan Africa; introduced to western and central Europe, and southeastern USA","Anseriformes","Anatidae (Ducks, Geese, and Waterfowl)",NA,NA,397,TRUE
"45",408,"rudshe",NA,NA,"species","Ruddy Shelduck","Tadorna ferruginea","breeds Iberian Peninsula and Mediterranean northern Africa eastward through southern Russia to eastern China and in the south through Türkiye to Tibetan Plateau including Ladakh; winters to Ethiopia, southern India, and southeastern Asia; introduced in central Europe and the Canary Islands, and appears frequently elsewhere","Anseriformes","Anatidae (Ducks, Geese, and Waterfowl)",NA,NA,400,FALSE
"46",413,"comshe",NA,NA,"species","Common Shelduck","Tadorna tadorna","breeds western Europe to east-central Asia; winters to northern Africa through southern Asia","Anseriformes","Anatidae (Ducks, Geese, and Waterfowl)",NA,NA,405,FALSE
"47",416,"spwgoo1",NA,NA,"species","Spur-winged Goose","Plectropterus gambensis",NA,"Anseriformes","Anatidae (Ducks, Geese, and Waterfowl)",NA,NA,408,FALSE
"48",431,"musduc",NA,NA,"species","Muscovy Duck","Cairina moschata","lowlands from northern Mexico south, west of the Andes, to southwestern Ecuador and, east of the Andes, to northeastern Argentina and Brazil","Anseriformes","Anatidae (Ducks, Geese, and Waterfowl)",NA,NA,423,TRUE
"49",441,"wooduc",NA,NA,"species","Wood Duck","Aix sponsa","inland waters of Canada to northern Mexico, the Bahamas, and Cuba","Anseriformes","Anatidae (Ducks, Geese, and Waterfowl)",NA,NA,433,TRUE
"50",461,"baitea",NA,NA,"species","Baikal Teal","Sibirionetta formosa","breeds in northern and eastern Siberia; winters Japan, Korea, and eastern China","Anseriformes","Anatidae (Ducks, Geese, and Waterfowl)",NA,NA,453,FALSE
"51",462,"gargan",NA,NA,"species","Garganey","Spatula querquedula","breeds Palearctic (except north); winters to central Africa through Indonesia","Anseriformes","Anatidae (Ducks, Geese, and Waterfowl)",NA,NA,454,FALSE
"52",468,"buwtea",NA,NA,"species","Blue-winged Teal","Spatula discors","breeds North America (except Arctic and western Alaska), mostly in central prairie regions; winters northern Mexico to Caribbean and coastal northern South America","Anseriformes","Anatidae (Ducks, Geese, and Waterfowl)",NA,NA,460,TRUE
"53",469,"cintea",NA,NA,"species","Cinnamon Teal","Spatula cyanoptera",NA,"Anseriformes","Anatidae (Ducks, Geese, and Waterfowl)",NA,NA,461,TRUE
"54",478,"redsho1",NA,NA,"species","Red Shoveler","Spatula platalea","southern Peru and southern Brazil to Tierra del Fuego and Falkland Islands","Anseriformes","Anatidae (Ducks, Geese, and Waterfowl)",NA,NA,469,FALSE
"55",483,"norsho",NA,NA,"species","Northern Shoveler","Spatula clypeata","breeds Holarctic (except Arctic); winters through eastern Africa, southern Asia, and Central America","Anseriformes","Anatidae (Ducks, Geese, and Waterfowl)",NA,NA,474,TRUE
"56",487,"gadwal",NA,NA,"species","Gadwall","Mareca strepera",NA,"Anseriformes","Anatidae (Ducks, Geese, and Waterfowl)",NA,NA,478,TRUE
"57",491,"falduc",NA,NA,"species","Falcated Duck","Mareca falcata","breeds Mongolia, eastern Siberia, and northeastern China; winters northern India to southern and eastern China, southern Korean Peninsula, and Japan","Anseriformes","Anatidae (Ducks, Geese, and Waterfowl)",NA,NA,482,FALSE
"58",494,"eurwig",NA,NA,"species","Eurasian Wigeon","Mareca penelope","breeds northern and central Eurasia; winters to northern Africa and southern Asia","Anseriformes","Anatidae (Ducks, Geese, and Waterfowl)",NA,NA,485,TRUE
"59",497,"amewig",NA,NA,"species","American Wigeon","Mareca americana","breeds Alaska to southern USA; winters through Central America and the Caribbean","Anseriformes","Anatidae (Ducks, Geese, and Waterfowl)",NA,NA,487,TRUE
"60",504,"chiwig1",NA,NA,"species","Chiloe Wigeon","Mareca sibilatrix","southern South America and Falkland Islands; winters to southeastern Brazil","Anseriformes","Anatidae (Ducks, Geese, and Waterfowl)",NA,NA,494,FALSE
"61",514,"pabduc1",NA,NA,"species","Pacific Black Duck","Anas superciliosa",NA,"Anseriformes","Anatidae (Ducks, Geese, and Waterfowl)",NA,NA,504,FALSE
"62",515,"pabduc2",NA,NA,"subspecies",NA,"Anas superciliosa superciliosa","Sumatra, Java, Bali, Lesser Sundas, Sulawesi region, Moluccas, southern New Guinea including Louisiade Archipelago (off southeastern New Guinea), Australia including Tasmania, and New Zealand and associated islands southward to Macquarie Island","Anseriformes","Anatidae (Ducks, Geese, and Waterfowl)",NA,NA,505,FALSE
"63",517,"layduc",NA,NA,"species","Laysan Duck","Anas laysanensis","Laysan Island (northwestern Hawaiian Islands)","Anseriformes","Anatidae (Ducks, Geese, and Waterfowl)",NA,NA,507,FALSE
"64",518,"hawduc",NA,NA,"species","Hawaiian Duck","Anas wyvilliana","Hawaiian Islands (Kauai and Oahu)","Anseriformes","Anatidae (Ducks, Geese, and Waterfowl)",NA,NA,508,FALSE
"65",523,"spbduc",NA,NA,"species","Eastern Spot-billed Duck","Anas zonorhyncha","breeds northeastern Asia; winters to southern China, Taiwan, and Philippines","Anseriformes","Anatidae (Ducks, Geese, and Waterfowl)",NA,NA,513,FALSE
"66",525,"mallar3",NA,NA,"species","Mallard","Anas platyrhynchos",NA,"Anseriformes","Anatidae (Ducks, Geese, and Waterfowl)",NA,NA,515,TRUE
"67",528,"mallar2",NA,NA,"domestic","Mallard (Domestic type)","Anas platyrhynchos (Domestic type)",NA,"Anseriformes","Anatidae (Ducks, Geese, and Waterfowl)",NA,NA,518,FALSE
"68",547,"mexduc",NA,NA,"species","Mexican Duck","Anas diazi","southeastern Arizona, southern New Mexico and western Texas (Trans-Pecos region) southward to central Mexico","Anseriformes","Anatidae (Ducks, Geese, and Waterfowl)",NA,NA,534,TRUE
"69",550,"ambduc",NA,NA,"species","American Black Duck","Anas rubripes","northeastern North America; winters to Bahamas and Gulf Coast","Anseriformes","Anatidae (Ducks, Geese, and Waterfowl)",NA,NA,537,TRUE
"70",554,"motduc",NA,NA,"species","Mottled Duck","Anas fulvigula",NA,"Anseriformes","Anatidae (Ducks, Geese, and Waterfowl)",NA,NA,541,TRUE
"71",563,"captea1",NA,NA,"species","Cape Teal","Anas capensis","locally from Sudan and Ethiopia to Namibia and South Africa","Anseriformes","Anatidae (Ducks, Geese, and Waterfowl)",NA,NA,550,FALSE
"72",564,"whcpin",NA,NA,"species","White-cheeked Pintail","Anas bahamensis",NA,"Anseriformes","Anatidae (Ducks, Geese, and Waterfowl)",NA,NA,551,FALSE
"73",567,"whcpin4",NA,NA,"subspecies",NA,"Anas bahamensis rubrirostris","Pacific coast of South America from Ecuador southward to central Chile; eastern South America from eastern Bolivia eastward to central and eastern Brazil and southward to northern Argentina and Uruguay","Anseriformes","Anatidae (Ducks, Geese, and Waterfowl)",NA,NA,554,FALSE
"74",571,"norpin",NA,NA,"species","Northern Pintail","Anas acuta","Palearctic and North America; winters to southern Eurasia and northern South America","Anseriformes","Anatidae (Ducks, Geese, and Waterfowl)",NA,NA,558,TRUE
"75",588,"gnwtea",NA,NA,"species","Green-winged Teal","Anas crecca",NA,"Anseriformes","Anatidae (Ducks, Geese, and Waterfowl)",NA,NA,574,TRUE
"76",590,"agwtea1",NA,NA,"group (monotypic)","Green-winged Teal (American)","Anas crecca carolinensis","breeds North America; winters to Mexico and West Indies","Anseriformes","Anatidae (Ducks, Geese, and Waterfowl)",NA,NA,576,FALSE
"77",605,"yebtea1",NA,NA,"species","Yellow-billed Teal","Anas flavirostris",NA,"Anseriformes","Anatidae (Ducks, Geese, and Waterfowl)",NA,NA,591,FALSE
"78",609,"spetea1",NA,NA,"slash","Andean/Yellow-billed Teal","Anas andium/flavirostris",NA,"Anseriformes","Anatidae (Ducks, Geese, and Waterfowl)",NA,NA,595,FALSE
"79",628,"anas1",NA,NA,"spuh","Anas sp.","Anas sp.",NA,"Anseriformes","Anatidae (Ducks, Geese, and Waterfowl)",NA,NA,614,FALSE
"80",630,"dabduc1",NA,NA,"spuh","dabbling duck sp.","Anatidae sp. (dabbling duck sp.)",NA,"Anseriformes","Anatidae (Ducks, Geese, and Waterfowl)",NA,NA,616,FALSE
"81",635,"recpoc",NA,NA,"species","Red-crested Pochard","Netta rufina","breeds from Europe (Iberian Peninsula northward to southern Denmark and Poland) eastward to central Asia (northwestern China and western Mongolia); somewhat local in Europe, more widespread to east; resident in southwestern Europe; elsewhere, winters from eastern Mediterranean eastward to northern India, south-central China, and northern Myanmar","Anseriformes","Anatidae (Ducks, Geese, and Waterfowl)",NA,NA,621,FALSE
"82",640,"robpoc1",NA,NA,"species","Rosy-billed Pochard","Netta peposaca","lowlands of southeastern Brazil to southern Argentina and Chile","Anseriformes","Anatidae (Ducks, Geese, and Waterfowl)",NA,NA,626,FALSE
"83",641,"canvas",NA,NA,"species","Canvasback","Aythya valisineria","breeds North America from northern Alaska and western Canada southward through northern California, southern Colorado, and Minnesota (USA); winters to central Mexico","Anseriformes","Anatidae (Ducks, Geese, and Waterfowl)",NA,NA,627,TRUE
"84",642,"redhea",NA,NA,"species","Redhead","Aythya americana","Alaska to southern USA; winters to Guatemala and Greater Antilles","Anseriformes","Anatidae (Ducks, Geese, and Waterfowl)",NA,NA,628,TRUE
"85",645,"compoc",NA,NA,"species","Common Pochard","Aythya ferina","Palearctic, breeding British Isles and southern Scandinavia eastward through east-central Russia, in south from Iberian Peninsula and Türkiye eastward through northeastern China; winters to tropical Africa and India eastward to Japan and southward to the northern Philippines","Anseriformes","Anatidae (Ducks, Geese, and Waterfowl)",NA,NA,631,FALSE
"86",648,"rinduc",NA,NA,"species","Ring-necked Duck","Aythya collaris","breeds Alaska to southern USA; winters to Panama and southern Lesser Antilles","Anseriformes","Anatidae (Ducks, Geese, and Waterfowl)",NA,NA,634,TRUE
"87",652,"ferduc",NA,NA,"species","Ferruginous Duck","Aythya nyroca","discontinuous Palearctic; winters to India, southeastern Asia, and eastern China","Anseriformes","Anatidae (Ducks, Geese, and Waterfowl)",NA,NA,638,FALSE
"88",662,"tufduc",NA,NA,"species","Tufted Duck","Aythya fuligula","breeds northern Palearctic from Iceland eastward to Kamchatka, southward to central Europe and Mongolia; winters to northern Africa and southern Asia","Anseriformes","Anatidae (Ducks, Geese, and Waterfowl)",NA,NA,648,TRUE
"89",669,"gresca",NA,NA,"species","Greater Scaup","Aythya marila",NA,"Anseriformes","Anatidae (Ducks, Geese, and Waterfowl)",NA,NA,655,TRUE
"90",675,"lessca","range","range changed from ""breeds North America from northern Alaska and western Canada southward through northern California, southern Colorado, and Minnesota (USA); winters to Hawaiian Islands,  the Caribbean, and northern South America"" to ""breeds North America from northern Alaska and western Canada southward through northern California, southern Colorado, and Minnesota (USA); winters to Hawaiian Islands, the Caribbean, and northern South America""","species","Lesser Scaup","Aythya affinis","breeds North America from northern Alaska and western Canada southward through northern California, southern Colorado, and Minnesota (USA); winters to Hawaiian Islands, the Caribbean, and northern South America","Anseriformes","Anatidae (Ducks, Geese, and Waterfowl)",NA,NA,661,TRUE
"91",683,"scaup",NA,NA,"slash","Greater/Lesser Scaup","Aythya marila/affinis",NA,"Anseriformes","Anatidae (Ducks, Geese, and Waterfowl)",NA,NA,669,TRUE
"92",684,"aythya1",NA,NA,"spuh","Aythya sp.","Aythya sp.",NA,"Anseriformes","Anatidae (Ducks, Geese, and Waterfowl)",NA,NA,670,FALSE
"93",685,"steeid",NA,NA,"species","Steller's Eider","Polysticta stelleri","northwestern and northeastern Siberia from Yamal Peninsula to Chukotka; and Arctic Coastal Plain, northern Alaska; winters to Kamchatka Peninsula, Commander and Kuril islands (southeastern Russia), and Aleutian Islands; also Kola Peninsula, Barents and White seas (northwestern Russia), and Baltic Sea","Anseriformes","Anatidae (Ducks, Geese, and Waterfowl)",NA,NA,671,TRUE
"94",686,"labduc",NA,NA,"species","Labrador Duck","Camptorhynchus labradorius","formerly northeastern North America; extinct, last reported 1875","Anseriformes","Anatidae (Ducks, Geese, and Waterfowl)",1,"1875",672,FALSE
"95",687,"speeid",NA,NA,"species","Spectacled Eider","Somateria fischeri","breeds north-central and northeastern Siberia from Lena Delta to Chukotka, and western and northern Alaska in Yukon Delta and Arctic Coastal Plain; winters polynyas (ice-free seas) between St. Lawrence and St. Matthew islands (northern Bering Sea)","Anseriformes","Anatidae (Ducks, Geese, and Waterfowl)",NA,NA,673,TRUE
"96",688,"kineid",NA,NA,"species","King Eider","Somateria spectabilis","breeds coastal northern and central Greenland, Svalbard (north of Norway), Russia from east of the White Sea to Chukotka (northeastern Russia); Arctic Coastal Plain of Alaska, northern slope of Canada and associated arctic islands; winters to Kamchatka (southeastern Russia) and Aleutian Islands, Newfoundland (southeastern Canada), southern Greenland, Iceland, and northern Norway","Anseriformes","Anatidae (Ducks, Geese, and Waterfowl)",NA,NA,674,TRUE
"97",690,"comeid",NA,NA,"species","Common Eider","Somateria mollissima",NA,"Anseriformes","Anatidae (Ducks, Geese, and Waterfowl)",NA,NA,676,TRUE
"98",701,"eider1",NA,NA,"spuh","eider sp.","Somateria sp.",NA,"Anseriformes","Anatidae (Ducks, Geese, and Waterfowl)",NA,NA,686,FALSE
"99",702,"harduc",NA,NA,"species","Harlequin Duck","Histrionicus histrionicus","breeds eastern Siberia and northern Japan, Alaska southward to Oregon and Wyoming, eastern Canada (southeastern Baffin Island southward to the Gulf of St. Lawrence), Greenland and Iceland; winters coastally from Siberia to Japan and Korea, from Alaska to central California, to the northeastern USA, southern Greenland, and Iceland","Anseriformes","Anatidae (Ducks, Geese, and Waterfowl)",NA,NA,687,TRUE
"100",703,"sursco",NA,NA,"species","Surf Scoter","Melanitta perspicillata","breeds northern North America; winters to Baja California and southern USA","Anseriformes","Anatidae (Ducks, Geese, and Waterfowl)",NA,NA,688,TRUE
"101",704,"whwsco3",NA,NA,"species","Velvet Scoter","Melanitta fusca","breeds northern Eurasia; winters Norway to Spain and Caspian Sea","Anseriformes","Anatidae (Ducks, Geese, and Waterfowl)",NA,NA,689,FALSE
"102",705,"whwsco2",NA,NA,"species","White-winged Scoter","Melanitta deglandi","breeds subarctic western Alaska to eastern shore of James Bay (east-central Canada); winters Aleutian Islands to central California (eastern North Pacific coast); and Gulf of St. Lawrence to New Jersey","Anseriformes","Anatidae (Ducks, Geese, and Waterfowl)",NA,NA,690,TRUE
"103",706,"whwsco1",NA,NA,"species","Stejneger's Scoter","Melanitta stejnegeri","breeds Yenisey Basin to Kamchatka (central and eastern Siberia), northeastern Kazakhstan, and northern and western Mongolia; winters to Kuril and Commander islands (southeastern Russia), coasts of Japan, and eastern Korean Peninsula (northeastern Pacific)","Anseriformes","Anatidae (Ducks, Geese, and Waterfowl)",NA,NA,691,FALSE
"104",711,"blksco1",NA,NA,"species","Common Scoter","Melanitta nigra","breeds southeastern Greenland, Iceland, Scotland, and northern and western Scandinavia to Olenyok River (north-central Siberia); winters to Baltic and North sea coasts, and eastern Atlantic coast to northwestern Africa","Anseriformes","Anatidae (Ducks, Geese, and Waterfowl)",NA,NA,695,FALSE
"105",712,"blksco2",NA,NA,"species","Black Scoter","Melanitta americana","breeds Yana River to Kamchatka (eastern Siberia), Alaska eastward to northwestern Yukon; eastern Northwest Territories and southwestern Nunavut to Newfoundland (central to eastern Canada); winters to central Japan (western North Pacific coast); Aleutian Islands, eastern North Pacific coast to central California; western North Atlantic coast from Newfoundland to northern Florida","Anseriformes","Anatidae (Ducks, Geese, and Waterfowl)",NA,NA,696,TRUE
"106",715,"scoter",NA,NA,"spuh","scoter sp.","Melanitta sp.",NA,"Anseriformes","Anatidae (Ducks, Geese, and Waterfowl)",NA,NA,699,TRUE
"107",716,"lotduc",NA,NA,"species","Long-tailed Duck","Clangula hyemalis","coasts of Holarctic region","Anseriformes","Anatidae (Ducks, Geese, and Waterfowl)",NA,NA,700,TRUE
"108",717,"buffle",NA,NA,"species","Bufflehead","Bucephala albeola","breeds northern North America; winters to central Mexico and Greater Antilles","Anseriformes","Anatidae (Ducks, Geese, and Waterfowl)",NA,NA,701,TRUE
"109",718,"comgol",NA,NA,"species","Common Goldeneye","Bucephala clangula",NA,"Anseriformes","Anatidae (Ducks, Geese, and Waterfowl)",NA,NA,702,TRUE
